{
  "schema_version": "strange-physics.contract-fixtures.v1",
  "canonical_profile": "strange-physics.python-json.v1",
  "bounds": {
    "max_bytes": 1048576,
    "max_depth": 32,
    "max_nodes": 100000
  },
  "description": "Synthetic compatibility vectors. Null schema expectation means strict JSON decoding was rejected, so structural validation is deliberately unassessed. Canonical expectations concern direct typed parsing, independent of strict-ingress acceptance. No fixture is scientific or authorization evidence.",
  "cases": [
    {
      "id": "opaque-number-0",
      "root": "core.Checkpoint",
      "raw_base64": "eyJhZ2VudF9pZCI6ImZpeHR1cmUiLCJ0aHJvdWdoX2luZGV4IjotMSwic3RhdGUiOnsidmFsdWUiOjF9fQ==",
      "raw_sha256": "da6b8098e6afda21a529c7f388f316329aba64cf42068ea09b6d9a3c5ec2ee1d",
      "expected": {
        "strict_json": true,
        "json_schema": true,
        "typed_json": true,
        "bounded_typed": true,
        "canonical_base64": "eyJhZ2VudF9pZCI6ImZpeHR1cmUiLCJzY2hlbWFfdmVyc2lvbiI6InN0cmFuZ2UtcGh5c2ljcy5jaGVja3BvaW50LnYxIiwic3RhdGUiOnsidmFsdWUiOjF9LCJ0aHJvdWdoX2luZGV4IjotMX0=",
        "canonical_sha256": "2c113ee55ec3920b0d1bf784bcdf5ae08a181f11df7cd472cc9ba611e1250aee"
      },
      "note": "Opaque JsonValue direct parsing is distinct from strict ingress and canonicalization.",
      "cross_message": null
    },
    {
      "id": "opaque-number-1",
      "root": "core.Checkpoint",
      "raw_base64": "eyJhZ2VudF9pZCI6ImZpeHR1cmUiLCJ0aHJvdWdoX2luZGV4IjotMSwic3RhdGUiOnsidmFsdWUiOjEuMH19",
      "raw_sha256": "d05fa4c303edd48191aa1537f2785f68c6f2336143acc92f211b166a411f1801",
      "expected": {
        "strict_json": true,
        "json_schema": true,
        "typed_json": true,
        "bounded_typed": true,
        "canonical_base64": "eyJhZ2VudF9pZCI6ImZpeHR1cmUiLCJzY2hlbWFfdmVyc2lvbiI6InN0cmFuZ2UtcGh5c2ljcy5jaGVja3BvaW50LnYxIiwic3RhdGUiOnsidmFsdWUiOjEuMH0sInRocm91Z2hfaW5kZXgiOi0xfQ==",
        "canonical_sha256": "145541091ecdb5ba9630c49560a24da1913e94f7079a51e233fc60c6df9bb3a4"
      },
      "note": "Opaque JsonValue direct parsing is distinct from strict ingress and canonicalization.",
      "cross_message": null
    },
    {
      "id": "opaque-number-2",
      "root": "core.Checkpoint",
      "raw_base64": "eyJhZ2VudF9pZCI6ImZpeHR1cmUiLCJ0aHJvdWdoX2luZGV4IjotMSwic3RhdGUiOnsidmFsdWUiOjFlMH19",
      "raw_sha256": "856928c27878a7d008776fc958076cbcb55dda6b782e6753c623090c25743caa",
      "expected": {
        "strict_json": true,
        "json_schema": true,
        "typed_json": true,
        "bounded_typed": true,
        "canonical_base64": "eyJhZ2VudF9pZCI6ImZpeHR1cmUiLCJzY2hlbWFfdmVyc2lvbiI6InN0cmFuZ2UtcGh5c2ljcy5jaGVja3BvaW50LnYxIiwic3RhdGUiOnsidmFsdWUiOjEuMH0sInRocm91Z2hfaW5kZXgiOi0xfQ==",
        "canonical_sha256": "145541091ecdb5ba9630c49560a24da1913e94f7079a51e233fc60c6df9bb3a4"
      },
      "note": "Opaque JsonValue direct parsing is distinct from strict ingress and canonicalization.",
      "cross_message": null
    },
    {
      "id": "opaque-number-3",
      "root": "core.Checkpoint",
      "raw_base64": "eyJhZ2VudF9pZCI6ImZpeHR1cmUiLCJ0aHJvdWdoX2luZGV4IjotMSwic3RhdGUiOnsidmFsdWUiOi0wfX0=",
      "raw_sha256": "5abbe70d7160d22ea1f4ad4ced767decb16692318900c05458fc38d891364d61",
      "expected": {
        "strict_json": true,
        "json_schema": true,
        "typed_json": true,
        "bounded_typed": true,
        "canonical_base64": "eyJhZ2VudF9pZCI6ImZpeHR1cmUiLCJzY2hlbWFfdmVyc2lvbiI6InN0cmFuZ2UtcGh5c2ljcy5jaGVja3BvaW50LnYxIiwic3RhdGUiOnsidmFsdWUiOjB9LCJ0aHJvdWdoX2luZGV4IjotMX0=",
        "canonical_sha256": "785fa15f3abd3dad253d50a08d32599f96495e0dc35ad942c000e9dbf4450491"
      },
      "note": "Opaque JsonValue direct parsing is distinct from strict ingress and canonicalization.",
      "cross_message": null
    },
    {
      "id": "opaque-number-4",
      "root": "core.Checkpoint",
      "raw_base64": "eyJhZ2VudF9pZCI6ImZpeHR1cmUiLCJ0aHJvdWdoX2luZGV4IjotMSwic3RhdGUiOnsidmFsdWUiOi0wLjB9fQ==",
      "raw_sha256": "abf9422496276461d1735c14f4d2322fcff4da69e415fa7a16918935e4455489",
      "expected": {
        "strict_json": true,
        "json_schema": true,
        "typed_json": true,
        "bounded_typed": true,
        "canonical_base64": "eyJhZ2VudF9pZCI6ImZpeHR1cmUiLCJzY2hlbWFfdmVyc2lvbiI6InN0cmFuZ2UtcGh5c2ljcy5jaGVja3BvaW50LnYxIiwic3RhdGUiOnsidmFsdWUiOi0wLjB9LCJ0aHJvdWdoX2luZGV4IjotMX0=",
        "canonical_sha256": "8e0cc342e1eb4af853dcee12540dcd4b745c87e6494c16fd28c5d2f3de58eabd"
      },
      "note": "Opaque JsonValue direct parsing is distinct from strict ingress and canonicalization.",
      "cross_message": null
    },
    {
      "id": "opaque-number-5",
      "root": "core.Checkpoint",
      "raw_base64": "eyJhZ2VudF9pZCI6ImZpeHR1cmUiLCJ0aHJvdWdoX2luZGV4IjotMSwic3RhdGUiOnsidmFsdWUiOjVlLTMyNH19",
      "raw_sha256": "513d1036b2d44765986c76ef1515c8cd079bc08d5ed5f00704855f20d052a8cb",
      "expected": {
        "strict_json": true,
        "json_schema": true,
        "typed_json": true,
        "bounded_typed": true,
        "canonical_base64": "eyJhZ2VudF9pZCI6ImZpeHR1cmUiLCJzY2hlbWFfdmVyc2lvbiI6InN0cmFuZ2UtcGh5c2ljcy5jaGVja3BvaW50LnYxIiwic3RhdGUiOnsidmFsdWUiOjVlLTMyNH0sInRocm91Z2hfaW5kZXgiOi0xfQ==",
        "canonical_sha256": "363d16e1b0c3ef3202c78e1f24506ec78d243e31c3a070a2247c3d4fab1c22bf"
      },
      "note": "Opaque JsonValue direct parsing is distinct from strict ingress and canonicalization.",
      "cross_message": null
    },
    {
      "id": "opaque-number-6",
      "root": "core.Checkpoint",
      "raw_base64": "eyJhZ2VudF9pZCI6ImZpeHR1cmUiLCJ0aHJvdWdoX2luZGV4IjotMSwic3RhdGUiOnsidmFsdWUiOjFlLTMyNX19",
      "raw_sha256": "8c76be48e76ffcbc78afecbd52352b124a91359038bec1af9b4f7d54330b7653",
      "expected": {
        "strict_json": true,
        "json_schema": true,
        "typed_json": true,
        "bounded_typed": true,
        "canonical_base64": "eyJhZ2VudF9pZCI6ImZpeHR1cmUiLCJzY2hlbWFfdmVyc2lvbiI6InN0cmFuZ2UtcGh5c2ljcy5jaGVja3BvaW50LnYxIiwic3RhdGUiOnsidmFsdWUiOjAuMH0sInRocm91Z2hfaW5kZXgiOi0xfQ==",
        "canonical_sha256": "88eefbb609c30adf3341822db04cd1a668a422cb42b5352d9995e8668beaa917"
      },
      "note": "Opaque JsonValue direct parsing is distinct from strict ingress and canonicalization.",
      "cross_message": null
    },
    {
      "id": "opaque-number-7",
      "root": "core.Checkpoint",
      "raw_base64": "eyJhZ2VudF9pZCI6ImZpeHR1cmUiLCJ0aHJvdWdoX2luZGV4IjotMSwic3RhdGUiOnsidmFsdWUiOjkwMDcxOTkyNTQ3NDA5OTN9fQ==",
      "raw_sha256": "1fba52b7b01635839fd5cd0b19e72e87bc592e0561c203b4ed8aa5f53ed9b8cf",
      "expected": {
        "strict_json": true,
        "json_schema": true,
        "typed_json": true,
        "bounded_typed": true,
        "canonical_base64": "eyJhZ2VudF9pZCI6ImZpeHR1cmUiLCJzY2hlbWFfdmVyc2lvbiI6InN0cmFuZ2UtcGh5c2ljcy5jaGVja3BvaW50LnYxIiwic3RhdGUiOnsidmFsdWUiOjkwMDcxOTkyNTQ3NDA5OTN9LCJ0aHJvdWdoX2luZGV4IjotMX0=",
        "canonical_sha256": "8cc273c16d161a974aaf0993cbbc790a4e7364d32fe094ef5007fe3a55b3f09a"
      },
      "note": "Opaque JsonValue direct parsing is distinct from strict ingress and canonicalization.",
      "cross_message": null
    },
    {
      "id": "opaque-number-8",
      "root": "core.Checkpoint",
      "raw_base64": "eyJhZ2VudF9pZCI6ImZpeHR1cmUiLCJ0aHJvdWdoX2luZGV4IjotMSwic3RhdGUiOnsidmFsdWUiOjFlMzA5fX0=",
      "raw_sha256": "69cfafd8764b8a10dfb9c9180984862cf64cffb0ffa11c956b60a32df1c9fe08",
      "expected": {
        "strict_json": false,
        "json_schema": null,
        "typed_json": true,
        "bounded_typed": false,
        "canonical_base64": null,
        "canonical_sha256": null
      },
      "note": "Opaque JsonValue direct parsing is distinct from strict ingress and canonicalization.",
      "cross_message": null
    },
    {
      "id": "opaque-number-9",
      "root": "core.Checkpoint",
      "raw_base64": "eyJhZ2VudF9pZCI6ImZpeHR1cmUiLCJ0aHJvdWdoX2luZGV4IjotMSwic3RhdGUiOnsidmFsdWUiOk5hTn19",
      "raw_sha256": "008de283b61ff4e1bff0a5b16d45a9675acb509802ac613f6e6f59c1c5e9d7b3",
      "expected": {
        "strict_json": false,
        "json_schema": null,
        "typed_json": true,
        "bounded_typed": false,
        "canonical_base64": null,
        "canonical_sha256": null
      },
      "note": "Opaque JsonValue direct parsing is distinct from strict ingress and canonicalization.",
      "cross_message": null
    },
    {
      "id": "opaque-number-10",
      "root": "core.Checkpoint",
      "raw_base64": "eyJhZ2VudF9pZCI6ImZpeHR1cmUiLCJ0aHJvdWdoX2luZGV4IjotMSwic3RhdGUiOnsidmFsdWUiOkluZmluaXR5fX0=",
      "raw_sha256": "f6299b2bfe4bf7a85a12ce9f1a03f47fbb17e6084b10490ba27347890d3a555f",
      "expected": {
        "strict_json": false,
        "json_schema": null,
        "typed_json": true,
        "bounded_typed": false,
        "canonical_base64": null,
        "canonical_sha256": null
      },
      "note": "Opaque JsonValue direct parsing is distinct from strict ingress and canonicalization.",
      "cross_message": null
    },
    {
      "id": "typed-number-0",
      "root": "research.LinearSpringModel",
      "raw_base64": "eyJmaXRfY29uZmlnX3NoYTI1NiI6IjIyMjIyMjIyMjIyMjIyMjIyMjIyMjIyMjIyMjIyMjIyMjIyMjIyMjIyMjIyMjIyMjIyMjIyMjIyMjIyMjIyMjIiLCJmaXRfcmVjb3JkX2luZGljZXMiOlswXSwiZml0dGVyX3ZlcnNpb24iOiJmaXh0dXJlLc6yLXYxIiwibGluZWFyIjoxLCJvYnNlcnZhdGlvbl9zaGEyNTYiOiIyNTUyZmRiYzZjZTFiZmU4Nzk2YWM5YTAyMzg3ZmU5YmFmZmUxOTI1MjQ5ZmNlMTcxODEyZmFiNTRiZWVmYzIwIiwic2NoZW1hX3ZlcnNpb24iOiJzdHJhbmdlLXBoeXNpY3MubGluZWFyLXNwcmluZy1tb2RlbC52MSIsInRocm91Z2hfaW5kZXgiOjF9",
      "raw_sha256": "65ee9f17775aa9f7fd4bd57dae845dba4a554a6a0fed44d9ea2d1bdbe8e5d081",
      "expected": {
        "strict_json": true,
        "json_schema": true,
        "typed_json": true,
        "bounded_typed": true,